

09:49:11.492368 IP 10.0.18.72.54408 > 10.0.18.52.5060: SIP: REGISTER sip:10.0.18.52:5060;transport=UDP SIP/2.0
09:49:11.500905 IP 10.0.18.72.54408 > 10.0.18.52.5060: SIP: REGISTER sip:10.0.18.52:5060;transport=UDP SIP/2.0
09:49:21.814982 IP 10.0.18.73.5060 > 10.0.18.52.5060: SIP: BYE sip:0002@10.0.18.52:5060 SIP/2.0
09:49:21.815334 IP 10.0.18.52.5060 > 10.0.18.73.5060: SIP: SIP/2.0 200 OK
09:49:22.045971 IP 10.0.18.72.54408 > 10.0.18.52.5060: SIP: SIP/2.0 481 Call/Transaction Does Not Exist
09:49:24.075682 IP 10.0.18.73.5060 > 10.0.18.52.5060: SIP: INVITE sip:0002@10.0.18.52 SIP/2.0
09:49:24.076141 IP 10.0.18.52.5060 > 10.0.18.73.5060: SIP: SIP/2.0 401 Unauthorized
09:49:24.099122 IP 10.0.18.73.5060 > 10.0.18.52.5060: SIP: ACK sip:0002@10.0.18.52 SIP/2.0
09:49:24.116449 IP 10.0.18.73.5060 > 10.0.18.52.5060: SIP: INVITE sip:0002@10.0.18.52 SIP/2.0
09:49:24.117144 IP 10.0.18.52.5060 > 10.0.18.73.5060: SIP: SIP/2.0 100 Trying
09:49:24.117361 IP 10.0.18.52.5060 > 10.0.18.73.5060: SIP: SIP/2.0 200 OK
09:49:24.156750 IP 10.0.18.73.5060 > 10.0.18.52.5060: SIP: ACK sip:0002@10.0.18.52:5060 SIP/2.0
09:49:24.385753 IP 10.0.18.72.54408 > 10.0.18.52.5060: SIP: SIP/2.0 100 Trying
09:49:24.605006 IP 10.0.18.72.54408 > 10.0.18.52.5060: SIP: SIP/2.0 180 Ringing
09:49:29.451313 IP 10.0.18.72.54408 > 10.0.18.52.5060: SIP: SIP/2.0 200 OK

09:49:29.940503 IP 10.0.18.72.54408 > 10.0.18.52.5060: SIP: SIP/2.0 200 OK
09:49:41.508740 IP 10.0.18.72.54408 > 10.0.18.52.5060: SIP
09:49:46.410076 IP 10.0.18.72.54408 > 10.0.18.52.5060: SIP: BYE sip:0005@10.0.18.52:5060 SIP/2.0
09:49:46.410786 IP 10.0.18.52.5060 > 10.0.18.73.5060: SIP: BYE sip:0005@10.0.18.73 SIP/2.0
09:49:46.910575 IP 10.0.18.52.5060 > 10.0.18.73.5060: SIP: BYE sip:0005@10.0.18.73 SIP/2.0
09:49:47.911733 IP 10.0.18.52.5060 > 10.0.18.73.5060: SIP: BYE sip:0005@10.0.18.73 SIP/2.0
09:49:49.447030 IP 10.0.18.73.5060 > 10.0.18.52.5060: SIP: SIP/2.0 200 OK
09:49:49.458050 IP 10.0.18.73.5060 > 10.0.18.52.5060: SIP: SIP/2.0 200 OK
09:49:49.466123 IP 10.0.18.73.5060 > 10.0.18.52.5060: SIP: SIP/2.0 200 OK
09:50:05.521181 IP 10.0.18.72.54408 > 10.0.18.52.5060: SIP: REGISTER sip:10.0.18.52:5060;transport=UDP SIP/2.0
09:50:05.528205 IP 10.0.18.72.54408 > 10.0.18.52.5060: SIP: REGISTER sip:10.0.18.52:5060;transport=UDP SIP/2.0
09:50:35.548867 IP 10.0.18.72.54408 > 10.0.18.52.5060: SIP
09:50:59.538725 IP 10.0.18.72.54408 > 10.0.18.52.5060: SIP: REGISTER sip:10.0.18.52:5060;transport=UDP SIP/2.0
09:50:59.545158 IP 10.0.18.72.54408 > 10.0.18.52.5060: SIP: REGISTER sip:10.0.18.52:5060;transport=UDP SIP/2.0
09:51:29.551096 IP 10.0.18.72.54408 > 10.0.18.52.5060: SIP


